MariaDB [abc]> use mydb;
Database changed
MariaDB [mydb]> select *
    -> from employee;
+--------+----------+------+------------+------+----------------------------+
| num    | name     | sex  | birth      | age  | address                    |
+--------+----------+------+------------+------+----------------------------+
| 000009 | 黃怡仁   | M    | 1961-10-07 |   43 | 台南市善化區茄拔里100之3號 |
| 000007 | 陳美美   | F    | 1975-02-06 |   29 | 高雄市前鎮區200號          |
| 000012 | 陳秀惠   | F    | 1974-11-20 |   30 | 台北市南京東路一段218號    |
| 000004 | 黃淑珍   | F    | 1973-08-29 |   31 | 台南市麻豆區中正路59號     |
| 000014 | 黃玉瑛   | F    | 1972-12-10 |   32 | 台南市善化區民權路89號     |
| 000010 | 王曉菁   | F    | 1966-10-17 |   38 | 高雄市中正四路112號        |
| 000019 | 王耿豪   | M    | 1971-02-03 |   33 | 北市大直街102號3樓         |
| 000002 | 陳美鳳   | F    | 1971-05-28 |   33 | 台南市白河區三明路192號    |
| 000015 | 王簡淑玲 | F    | 1959-10-19 |   45 | 台南市南化區中正路9號      |
| 000013 | 李英王   | M    | 1970-07-26 |   34 | 台南市仁德區勝利路116號    |
| 000020 | 鄭淑蘭   | F    | 1969-09-18 |   35 | 新北市中和區中山路177號    |
| 000017 | 李玉龍   | M    | 1968-01-30 |   36 | 台北市內湖區內湖路二段5號  |
| 000005 | 王五郎   | M    | 1966-11-06 |   38 | 南投縣北港村3號            |
| 000001 | 張大田   | M    | 1972-06-23 |   32 | 台南市中西區中正路18號之2  |
| 000016 | 高陳淑敏 | F    | 1964-06-16 |   40 | 台北市華陰街10號           |
| 000006 | 張玉明   | M    | 1964-07-25 |   40 | 高雄市前鎮區28之1號        |
| 000003 | 李王育   | M    | 1956-02-28 |   48 | 台南市安南區府前路90巷2號  |
| 000008 | 李小隆   | M    | 1961-09-09 |   43 | 台北市士林區小北街21號     |
| 000011 | 張玉風   | M    | 1957-04-19 |   47 | 高雄市路竹區民權路89號     |
| 000018 | 廖元瑛   | M    | 1973-03-30 |   31 | 北市天母富貴一路5巷8號     |
+--------+----------+------+------------+------+----------------------------+
20 rows in set (0.000 sec)

MariaDB [mydb]> update employee
    -> set age=age+1;
Query OK, 20 rows affected (0.024 sec)
Rows matched: 20  Changed: 20  Warnings: 0

MariaDB [mydb]> select *
    -> from employee;
+--------+----------+------+------------+------+----------------------------+
| num    | name     | sex  | birth      | age  | address                    |
+--------+----------+------+------------+------+----------------------------+
| 000009 | 黃怡仁   | M    | 1961-10-07 |   44 | 台南市善化區茄拔里100之3號 |
| 000007 | 陳美美   | F    | 1975-02-06 |   30 | 高雄市前鎮區200號          |
| 000012 | 陳秀惠   | F    | 1974-11-20 |   31 | 台北市南京東路一段218號    |
| 000004 | 黃淑珍   | F    | 1973-08-29 |   32 | 台南市麻豆區中正路59號     |
| 000014 | 黃玉瑛   | F    | 1972-12-10 |   33 | 台南市善化區民權路89號     |
| 000010 | 王曉菁   | F    | 1966-10-17 |   39 | 高雄市中正四路112號        |
| 000019 | 王耿豪   | M    | 1971-02-03 |   34 | 北市大直街102號3樓         |
| 000002 | 陳美鳳   | F    | 1971-05-28 |   34 | 台南市白河區三明路192號    |
| 000015 | 王簡淑玲 | F    | 1959-10-19 |   46 | 台南市南化區中正路9號      |
| 000013 | 李英王   | M    | 1970-07-26 |   35 | 台南市仁德區勝利路116號    |
| 000020 | 鄭淑蘭   | F    | 1969-09-18 |   36 | 新北市中和區中山路177號    |
| 000017 | 李玉龍   | M    | 1968-01-30 |   37 | 台北市內湖區內湖路二段5號  |
| 000005 | 王五郎   | M    | 1966-11-06 |   39 | 南投縣北港村3號            |
| 000001 | 張大田   | M    | 1972-06-23 |   33 | 台南市中西區中正路18號之2  |
| 000016 | 高陳淑敏 | F    | 1964-06-16 |   41 | 台北市華陰街10號           |
| 000006 | 張玉明   | M    | 1964-07-25 |   41 | 高雄市前鎮區28之1號        |
| 000003 | 李王育   | M    | 1956-02-28 |   49 | 台南市安南區府前路90巷2號  |
| 000008 | 李小隆   | M    | 1961-09-09 |   44 | 台北市士林區小北街21號     |
| 000011 | 張玉風   | M    | 1957-04-19 |   48 | 高雄市路竹區民權路89號     |
| 000018 | 廖元瑛   | M    | 1973-03-30 |   32 | 北市天母富貴一路5巷8號     |
+--------+----------+------+------------+------+----------------------------+
20 rows in set (0.000 sec)

MariaDB [mydb]> delete from employee
    -> where num>="000010";
Query OK, 11 rows affected (0.044 sec)

MariaDB [mydb]> select *
    -> from employee;
+--------+--------+------+------------+------+----------------------------+
| num    | name   | sex  | birth      | age  | address                    |
+--------+--------+------+------------+------+----------------------------+
| 000009 | 黃怡仁 | M    | 1961-10-07 |   44 | 台南市善化區茄拔里100之3號 |
| 000007 | 陳美美 | F    | 1975-02-06 |   30 | 高雄市前鎮區200號          |
| 000004 | 黃淑珍 | F    | 1973-08-29 |   32 | 台南市麻豆區中正路59號     |
| 000002 | 陳美鳳 | F    | 1971-05-28 |   34 | 台南市白河區三明路192號    |
| 000005 | 王五郎 | M    | 1966-11-06 |   39 | 南投縣北港村3號            |
| 000001 | 張大田 | M    | 1972-06-23 |   33 | 台南市中西區中正路18號之2  |
| 000006 | 張玉明 | M    | 1964-07-25 |   41 | 高雄市前鎮區28之1號        |
| 000003 | 李王育 | M    | 1956-02-28 |   49 | 台南市安南區府前路90巷2號  |
| 000008 | 李小隆 | M    | 1961-09-09 |   44 | 台北市士林區小北街21號     |
+--------+--------+------+------------+------+----------------------------+
9 rows in set (0.001 sec)

MariaDB [mydb]> select *
    -> from employee
    -> order by num;
+--------+--------+------+------------+------+----------------------------+
| num    | name   | sex  | birth      | age  | address                    |
+--------+--------+------+------------+------+----------------------------+
| 000001 | 張大田 | M    | 1972-06-23 |   33 | 台南市中西區中正路18號之2  |
| 000002 | 陳美鳳 | F    | 1971-05-28 |   34 | 台南市白河區三明路192號    |
| 000003 | 李王育 | M    | 1956-02-28 |   49 | 台南市安南區府前路90巷2號  |
| 000004 | 黃淑珍 | F    | 1973-08-29 |   32 | 台南市麻豆區中正路59號     |
| 000005 | 王五郎 | M    | 1966-11-06 |   39 | 南投縣北港村3號            |
| 000006 | 張玉明 | M    | 1964-07-25 |   41 | 高雄市前鎮區28之1號        |
| 000007 | 陳美美 | F    | 1975-02-06 |   30 | 高雄市前鎮區200號          |
| 000008 | 李小隆 | M    | 1961-09-09 |   44 | 台北市士林區小北街21號     |
| 000009 | 黃怡仁 | M    | 1961-10-07 |   44 | 台南市善化區茄拔里100之3號 |
+--------+--------+------+------------+------+----------------------------+
9 rows in set (0.000 sec)

MariaDB [mydb]> delete from employee;
Query OK, 9 rows affected (0.021 sec)

MariaDB [mydb]> select * from employee;
Empty set (0.000 sec)

MariaDB [mydb]> show columns from employee;
+---------+---------------+------+-----+---------+-------+
| Field   | Type          | Null | Key | Default | Extra |
+---------+---------------+------+-----+---------+-------+
| num     | char(6)       | YES  |     | NULL    |       |
| name    | char(8)       | YES  |     | NULL    |       |
| sex     | enum('F','M') | YES  |     | NULL    |       |
| birth   | date          | YES  |     | NULL    |       |
| age     | tinyint(4)    | YES  |     | NULL    |       |
| address | char(28)      | YES  |     | NULL    |       |
+---------+---------------+------+-----+---------+-------+
6 rows in set (0.002 sec)

MariaDB [mydb]> describe employee;
+---------+---------------+------+-----+---------+-------+
| Field   | Type          | Null | Key | Default | Extra |
+---------+---------------+------+-----+---------+-------+
| num     | char(6)       | YES  |     | NULL    |       |
| name    | char(8)       | YES  |     | NULL    |       |
| sex     | enum('F','M') | YES  |     | NULL    |       |
| birth   | date          | YES  |     | NULL    |       |
| age     | tinyint(4)    | YES  |     | NULL    |       |
| address | char(28)      | YES  |     | NULL    |       |
+---------+---------------+------+-----+---------+-------+
6 rows in set (0.003 sec)

MariaDB [mydb]> alter table employee
    -> modify num char(10);
Query OK, 0 rows affected (0.512 sec)
Records: 0  Duplicates: 0  Warnings: 0

MariaDB [mydb]> describe employee;
+---------+---------------+------+-----+---------+-------+
| Field   | Type          | Null | Key | Default | Extra |
+---------+---------------+------+-----+---------+-------+
| num     | char(10)      | YES  |     | NULL    |       |
| name    | char(8)       | YES  |     | NULL    |       |
| sex     | enum('F','M') | YES  |     | NULL    |       |
| birth   | date          | YES  |     | NULL    |       |
| age     | tinyint(4)    | YES  |     | NULL    |       |
| address | char(28)      | YES  |     | NULL    |       |
+---------+---------------+------+-----+---------+-------+
6 rows in set (0.003 sec)

MariaDB [mydb]> alter table employee
    -> add memo text;
Query OK, 0 rows affected (0.032 sec)
Records: 0  Duplicates: 0  Warnings: 0

MariaDB [mydb]> describe employee;
+---------+---------------+------+-----+---------+-------+
| Field   | Type          | Null | Key | Default | Extra |
+---------+---------------+------+-----+---------+-------+
| num     | char(10)      | YES  |     | NULL    |       |
| name    | char(8)       | YES  |     | NULL    |       |
| sex     | enum('F','M') | YES  |     | NULL    |       |
| birth   | date          | YES  |     | NULL    |       |
| age     | tinyint(4)    | YES  |     | NULL    |       |
| address | char(28)      | YES  |     | NULL    |       |
| memo    | text          | YES  |     | NULL    |       |
+---------+---------------+------+-----+---------+-------+
7 rows in set (0.002 sec)

MariaDB [mydb]> alter table employee
    -> drop age;
Query OK, 0 rows affected (0.478 sec)
Records: 0  Duplicates: 0  Warnings: 0

MariaDB [mydb]> describe employee;
+---------+---------------+------+-----+---------+-------+
| Field   | Type          | Null | Key | Default | Extra |
+---------+---------------+------+-----+---------+-------+
| num     | char(10)      | YES  |     | NULL    |       |
| name    | char(8)       | YES  |     | NULL    |       |
| sex     | enum('F','M') | YES  |     | NULL    |       |
| birth   | date          | YES  |     | NULL    |       |
| address | char(28)      | YES  |     | NULL    |       |
| memo    | text          | YES  |     | NULL    |       |
+---------+---------------+------+-----+---------+-------+
6 rows in set (0.002 sec)

MariaDB [mydb]> alter table employee
    -> change num no char(6);
Query OK, 0 rows affected (0.512 sec)
Records: 0  Duplicates: 0  Warnings: 0

MariaDB [mydb]> describe employee;
+---------+---------------+------+-----+---------+-------+
| Field   | Type          | Null | Key | Default | Extra |
+---------+---------------+------+-----+---------+-------+
| no      | char(6)       | YES  |     | NULL    |       |
| name    | char(8)       | YES  |     | NULL    |       |
| sex     | enum('F','M') | YES  |     | NULL    |       |
| birth   | date          | YES  |     | NULL    |       |
| address | char(28)      | YES  |     | NULL    |       |
| memo    | text          | YES  |     | NULL    |       |
+---------+---------------+------+-----+---------+-------+
6 rows in set (0.002 sec)

MariaDB [mydb]>